Title,Link
COVID-19 Vaccine Efficacy Study,https://www.ncbi.nlm.nih.gov/pmc/articles/PMC11386075/
Cancer Immunotherapy Research,https://www.ncbi.nlm.nih.gov/pmc/articles/PMC5498037/
Diabetes Treatment with Metformin,https://www.ncbi.nlm.nih.gov/pmc/articles/PMC11223344/
COVID-19 Long-term Effects,https://www.ncbi.nlm.nih.gov/pmc/articles/PMC11445567/
Cancer Genomics and Personalized Medicine,https://www.ncbi.nlm.nih.gov/pmc/articles/PMC5532123/
Mental Health During COVID-19 Pandemic,https://www.ncbi.nlm.nih.gov/pmc/articles/PMC11556678/
Advances in Cancer Detection Methods,https://www.ncbi.nlm.nih.gov/pmc/articles/PMC5543211/
Diabetes Prevention Strategies,https://www.ncbi.nlm.nih.gov/pmc/articles/PMC11223345/
